[
  {
    "order_no": "2017111401",
    "amount": 988.00,
    "consignee": "王先生",
    "phone": "13913580888",
    "region": "江苏省苏州市吴中区",
    "address": "XX路999号"
  },
  {
    "order_no": "2017111402",
    "amount": 388.00,
    "consignee": "田先生",
    "phone": "13913580000",
    "region": "江苏省苏州市吴中区",
    "address": "林泉街333号"
  }
]